{
	"background_color": [ 0.846, 0.933, 0.949 ],
	"camera": {
		"position": [
			58.20600128173828,
			24.92840003967285,
			52.950096130371094
		],
		"target": [
			-1.505810022354126,
			5.869430065155029,
			-2.1437699794769287
		],
		"up": [ 0.0, 1.0, 0.0 ],
		"client_width": 1280,
		"client_height": 720,
		"fov": 0.7853981
	},
	"materials": [
		{
			"name": "GroundInner",
			"type": "matte",
			"albedo": {
				"type": "constant",
				"value": [ 0.456263, 0.456263, 0.456263 ]
			}
		},
		{
			"name": "GroundOuter",
			"type": "matte",
			"albedo": {
				"type": "constant",
				"value": [ 0.456263, 0.456263, 0.456263 ]
			}
		},
		{
			"name": "Cloth",
			"type": "matte",
			"albedo": {
				"type": "constant",
				"value": [ 0.456263, 0.456263, 0.456263 ]
			}
		},
		{
			"name": "Dragon",
			"type": "matte",
			"albedo": {
				"type": "constant",
				"value": [ 0.79311, 0.79311, 0.79311 ]
			}
		},
		{
			"name": "Blade",
			"type": "matte",
			"albedo": {
				"type": "constant",
				"value": [ 0.79311, 0.79311, 0.79311 ]
			}
		},
		{
			"name": "Sword",
			"type": "matte",
			"albedo": {
				"type": "constant",
				"value": [ 0.79311, 0.79311, 0.79311 ]
			}
		},
		{
			"name": "Deco",
			"type": "matte",
			"albedo": {
				"type": "constant",
				"value": [ 0.79311, 0.79311, 0.79311 ]
			}
		},
		{
			"name": "Diamond",
			"type": "matte",
			"albedo": {
				"type": "constant",
				"value": [ 0.79311, 0.79311, 0.79311 ]
			}
		},
		{
			"name": "Deco2",
			"type": "matte",
			"albedo": {
				"type": "constant",
				"value": [ 0.79311, 0.79311, 0.79311 ]
			}
		}
	],
	"media": [],
	"primitives": [
		{
			"name": "GroundOuter",
			"type": "lmf",
			"file_path": "models/Mesh011.lmf",
			"material": "GroundOuter"
		},
		{
			"name": "Cloth",
			"type": "lmf",
			"file_path": "models/Mesh010.lmf",
			"material": "Cloth"
		},
		{
			"name": "GroundOuter",
			"type": "lmf",
			"file_path": "models/Mesh005.lmf",
			"material": "GroundOuter"
		},
		{
			"name": "GroundOuter",
			"type": "lmf",
			"file_path": "models/Mesh006.lmf",
			"material": "GroundOuter"
		},
		{
			"name": "GroundInner",
			"type": "lmf",
			"file_path": "models/Mesh012.lmf",
			"material": "GroundInner"
		},
		{
			"name": "GroundOuter",
			"type": "lmf",
			"file_path": "models/Mesh007.lmf",
			"material": "GroundOuter"
		},
		{
			"name": "Dragon",
			"type": "lmf",
			"file_path": "models/Mesh008.lmf",
			"material": "Dragon"
		},
		{
			"name": "Dragon",
			"type": "lmf",
			"file_path": "models/Mesh013.lmf",
			"material": "Dragon"
		},
		{
			"name": "Dragon",
			"type": "lmf",
			"file_path": "models/Mesh014.lmf",
			"material": "Dragon"
		},
		{
			"name": "Dragon",
			"type": "lmf",
			"file_path": "models/Mesh015.lmf",
			"material": "Dragon"
		},
		{
			"name": "Blade",
			"type": "lmf",
			"file_path": "models/Mesh004.lmf",
			"material": "Blade"
		},
		{
			"name": "Sword",
			"type": "lmf",
			"file_path": "models/Mesh009.lmf",
			"material": "Sword"
		},
		{
			"name": "Deco",
			"type": "lmf",
			"file_path": "models/Mesh003.lmf",
			"material": "Deco"
		},
		{
			"name": "Diamond",
			"type": "lmf",
			"file_path": "models/Mesh002.lmf",
			"material": "Diamond"
		},
		{
			"name": "Deco2",
			"type": "lmf",
			"file_path": "models/Mesh001.lmf",
			"material": "Deco2"
		},
		{
			"name": "Deco2",
			"type": "lmf",
			"file_path": "models/Mesh000.lmf",
			"material": "Deco2"
		}
	]
}
